{"run":76,"commit":"85e9254","metric":1.241,"metrics":{},"status":"keep","description":"Extend Block._create usage to all remaining Block.text single-row paths (width=None, non-ASCII NONE, ELLIPSIS variants); eliminates more _freeze_cell_rows + validation overhead.","timestamp":1773538212939,"segment":3}
{"run":77,"commit":"85e9254","metric":1.256,"metrics":{},"status":"discard","description":"Extended _create to Block.empty and Block.column; essentially neutral since these aren't hot in the benchmark.","timestamp":1773538235865,"segment":3}
{"run":78,"commit":"40ee7be","metric":1.194,"metrics":{},"status":"keep","description":"Cache Style.merge results in a module-level dict keyed by (self, other); avoids redundant Style construction for repeated merge patterns. render_ms 0.860→0.822, overall 1.241→1.194ms.","timestamp":1773538326073,"segment":3}
{"run":79,"commit":"a933bd5","metric":1.188,"metrics":{},"status":"keep","description":"Cache char_width results for non-ASCII characters to avoid repeated wcwidth calls; marginal but consistent improvement for workloads with repeated Unicode characters like status icons.","timestamp":1773538367613,"segment":3}
{"run":80,"commit":"0dffcbd","metric":1.137,"metrics":{},"status":"keep","description":"Cache display_width results for non-ASCII strings to avoid repeated wcswidth calls; render_ms 0.820→0.760, overall 1.188→1.137ms. The wcswidth function was a top-3 cost that is now nearly eliminated on repeated text.","timestamp":1773538387008,"segment":3}
{"run":81,"commit":"fa6baab","metric":1.124,"metrics":{},"status":"keep","description":"Use _cached_cell in _cells_from_text non-ASCII path so Unicode characters also get cached Cell objects; reduces Cell.__init__ calls and improves diff via identity comparison. diff_ms 0.146→0.132, overall 1.137→1.124ms.","timestamp":1773538420343,"segment":3}
{"run":82,"commit":"fa6baab","metric":1.151,"metrics":{},"status":"discard","description":"Extended _cached_cell to _char_wrap; within noise of current best since _char_wrap is called infrequently.","timestamp":1773538453349,"segment":3}
{"run":83,"commit":"b929a94","metric":1.09,"metrics":{},"status":"keep","description":"Use try/except in _ascii_row_tuple to skip the per-char cache-prime loop on the hot path; most calls have all chars already cached, so the try-fast/except-slow pattern saves iteration overhead. render_ms 0.763→0.741, overall 1.124→1.090ms.","timestamp":1773538530119,"segment":3}
{"run":84,"commit":"1fc72ef","metric":1.051,"metrics":{},"status":"keep","description":"Apply same try/except cache pattern to _ascii_cells; avoids per-char dict membership check on the hot path. render_ms 0.741→0.713, overall 1.090→1.051ms.","timestamp":1773538547209,"segment":3}
{"run":85,"commit":"faba369","metric":1.046,"metrics":{},"status":"keep","description":"Apply try/except cache pattern to _cells_from_text ASCII path for consistency; marginal improvement since most ASCII calls go through _ascii_row_tuple/_ascii_cells instead.","timestamp":1773538568669,"segment":3}
{"run":86,"commit":"fa0e306","metric":1.026,"metrics":{},"status":"keep","description":"Add dedicated _space_cells cache in _pad_row to avoid the two-level _cached_cell lookup for the common space padding case; render_ms 0.698→0.692, overall 1.046→1.026ms.","timestamp":1773538617127,"segment":3}
{"run":87,"commit":"fa0e306","metric":1.08,"metrics":{},"status":"discard","description":"Used _space_cells cache in _ascii_row_tuple padding too; within noise of current best.","timestamp":1773538652191,"segment":3}
{"run":88,"commit":"fa0e306","metric":1.034,"metrics":{},"status":"discard","description":"Resume-session baseline: 1.034ms. render=0.696, diff=0.131, paint=0.035.","timestamp":1773538689327,"segment":3}
{"run":89,"commit":"fa0e306","metric":1.084,"metrics":{},"status":"discard","description":"Added ASCII fast path for _word_wrap tracking line length instead of calling display_width; didn't beat baseline since display_width ASCII path is already fast and _word_wrap isn't called often.","timestamp":1773538784951,"segment":3}
{"run":90,"commit":"9b387d7","metric":1.018,"metrics":{},"status":"keep","description":"Inline ASCII check in _cells_from_text non-ASCII loop to skip char_width function call for ASCII characters; most non-ASCII strings are mostly ASCII with a few Unicode chars, so this avoids ~80% of char_width calls. render_ms 0.696→0.682, overall 1.026→1.018ms.","timestamp":1773538851103,"segment":3}
{"run":91,"commit":"d9d62e1","metric":0.983,"metrics":{},"status":"keep","description":"Inline cell cache lookup in _cells_from_text non-ASCII loop, eliminating 57K _cached_cell function calls per 200 renders; direct dict.get + conditional set avoids two-level lookup overhead. render_ms 0.682→0.641, overall 1.018→0.983ms — SUB-1MS ACHIEVED!","timestamp":1773538887913,"segment":3}
